SET @base_seq = (SELECT CAST(variable_value AS UNSIGNED) FROM performance_schema.global_status WHERE variable_name = 'Lizard_current_gcn');
create procedure print_idx_image(in image_idx int)
begin
set @image_gcn = (select image_gcn from foo_history where id = image_idx);
select image_idx, foo.* from foo as of gcn @image_gcn;
end //
create procedure print_all_images(in n_image int)
begin
declare image_idx int default 1;
while image_idx <= n_image DO
call print_idx_image(image_idx);
set image_idx = image_idx + 1;
end while;
end //
create procedure update_foo_history()
begin
set @image_number = @image_number + 1;
set @i_gcn = (select VARIABLE_VALUE from performance_schema.global_status where variable_name = 'Lizard_current_gcn');
set @i_gcn = @i_gcn + 1;
insert into foo_history (image_gcn) values (@i_gcn);
end //
create table foo_history (id int auto_increment, image_gcn bigint, primary key(id));
create table foo (id int, sec int, primary key(id), index sec (sec));
set @image_number = 0;
begin;
insert into foo values (1, 10);
commit;
call update_foo_history();
begin;
insert into foo values (2, 20);
commit;
call update_foo_history();
begin;
delete from foo where id = 2;
commit;
call update_foo_history();
begin;
update foo set id = 3 where id = 2;
commit;
call update_foo_history();
call print_all_images(@image_number);
image_idx	id	sec
1	1	10
image_idx	id	sec
2	1	10
2	2	20
image_idx	id	sec
3	1	10
image_idx	id	sec
4	1	10
# restart
select @@global.innodb_undo_retention;
@@global.innodb_undo_retention
1800
select @@global.innodb_undo_space_reserved_size;
@@global.innodb_undo_space_reserved_size
1024
call print_all_images(4);
image_idx	id	sec
1	1	10
image_idx	id	sec
2	1	10
2	2	20
image_idx	id	sec
3	1	10
image_idx	id	sec
4	1	10
drop table foo;
drop table foo_history;
drop procedure print_idx_image;
drop procedure print_all_images;
drop procedure update_foo_history;
