DROP TABLE IF EXISTS c5;
CREATE TABLE c5 (
id double(10,2) NOT NULL,
tfloat float(12,2),
tdecimal decimal(10,2),
value VARCHAR(50) NOT NULL,
PRIMARY KEY (id, tfloat, tdecimal)
) ENGINE=InnoDB;
Warnings:
Warning	1681	Specifying number of digits for floating point data types is deprecated and will be removed in a future release.
Warning	1681	Specifying number of digits for floating point data types is deprecated and will be removed in a future release.
call polarx.changeset_start('c5');
TABLE
c5
call polarx.changeset_fetch('c5');
OP	PK
insert into c5 values (1.1, 50.1, 75.85, "a");
insert into c5 values (1.1, 50.1, 39.29, "a");
insert into c5 values (1.1, 50.1, 43.39, "a");
insert into c5 values (1.1, 0.8, 94.91, "a");
insert into c5 values (1.1, 0.8, 52.48, "a");
insert into c5 values (1.1, 0.8, 12.94, "a");
insert into c5 values (1.1, 100.1, 24.58, "a");
insert into c5 values (1.1, 100.1, 53.48, "a");
insert into c5 values (1.1, 100.1, 23.48, "a");
insert into c5 values (2.2, 95.43, 259.47, "b");
insert into c5 values (2.2, 95.43, 258.49, "b");
insert into c5 values (2.2, 95.43, 19.54, "b");
insert into c5 values (2.2, 2473.1, 589.90, "b");
insert into c5 values (2.2, 2473.1, 298.85, "b");
insert into c5 values (2.2, 2473.1, 986.68, "b");
insert into c5 values (2.2, 478.1, 29.58, "b");
insert into c5 values (2.2, 478.1, 965.89, "b");
insert into c5 values (2.2, 478.1, 592.85, "b");
insert into c5 values (3.3, 458.3, 47.47, "c");
insert into c5 values (3.3, 458.3, 49.48, "c");
insert into c5 values (3.3, 458.3, 329.17, "c");
insert into c5 values (3.3, 548.4, 8584.1, "c");
insert into c5 values (3.3, 548.4, 19.48, "c");
insert into c5 values (3.3, 548.4, 548.4, "c");
insert into c5 values (3.3, 925.5, 49.87, "c");
insert into c5 values (3.3, 925.5, 55.48, "c");
insert into c5 values (3.3, 925.5, 25.97, "c");
select * from c5;
id	tfloat	tdecimal	value
1.10	0.80	12.94	a
1.10	0.80	52.48	a
1.10	0.80	94.91	a
1.10	50.10	39.29	a
1.10	50.10	43.39	a
1.10	50.10	75.85	a
1.10	100.10	23.48	a
1.10	100.10	24.58	a
1.10	100.10	53.48	a
2.20	95.43	19.54	b
2.20	95.43	258.49	b
2.20	95.43	259.47	b
2.20	478.10	29.58	b
2.20	478.10	592.85	b
2.20	478.10	965.89	b
2.20	2473.10	298.85	b
2.20	2473.10	589.90	b
2.20	2473.10	986.68	b
3.30	458.30	47.47	c
3.30	458.30	49.48	c
3.30	458.30	329.17	c
3.30	548.40	19.48	c
3.30	548.40	548.40	c
3.30	548.40	8584.10	c
3.30	925.50	25.97	c
3.30	925.50	49.87	c
3.30	925.50	55.48	c
call polarx.changeset_stats('c5');
SCHEMA	TABLE	NUM_INSERTS	NUM_UPDATES	NUM_DELETES	NUM_FILES	MEMORY_SIZE
test	c5	27	0	0	0	1971
call polarx.changeset_fetch('c5');
OP	id	tfloat	tdecimal
INSERT	1.10	0.80	12.94
INSERT	1.10	0.80	52.48
INSERT	1.10	0.80	94.91
INSERT	1.10	50.10	39.29
INSERT	1.10	50.10	43.39
INSERT	1.10	50.10	75.85
INSERT	1.10	100.10	23.48
INSERT	1.10	100.10	24.58
INSERT	1.10	100.10	53.48
INSERT	2.20	95.43	19.54
INSERT	2.20	95.43	258.49
INSERT	2.20	95.43	259.47
INSERT	2.20	478.10	29.58
INSERT	2.20	478.10	592.85
INSERT	2.20	478.10	965.89
INSERT	2.20	2473.10	298.85
INSERT	2.20	2473.10	589.90
INSERT	2.20	2473.10	986.68
INSERT	3.30	458.30	47.47
INSERT	3.30	458.30	49.48
INSERT	3.30	458.30	329.17
INSERT	3.30	548.40	19.48
INSERT	3.30	548.40	548.40
INSERT	3.30	548.40	8584.10
INSERT	3.30	925.50	25.97
INSERT	3.30	925.50	49.87
INSERT	3.30	925.50	55.48
update c5 set value = "d";
call polarx.changeset_stats('c5');
SCHEMA	TABLE	NUM_INSERTS	NUM_UPDATES	NUM_DELETES	NUM_FILES	MEMORY_SIZE
test	c5	27	27	0	0	5913
call polarx.changeset_fetch('c5');
OP	id	tfloat	tdecimal
DELETE	1.10	0.80	12.94
INSERT	1.10	0.80	12.94
DELETE	1.10	0.80	52.48
INSERT	1.10	0.80	52.48
DELETE	1.10	0.80	94.91
INSERT	1.10	0.80	94.91
DELETE	1.10	50.10	39.29
INSERT	1.10	50.10	39.29
DELETE	1.10	50.10	43.39
INSERT	1.10	50.10	43.39
DELETE	1.10	50.10	75.85
INSERT	1.10	50.10	75.85
DELETE	1.10	100.10	23.48
INSERT	1.10	100.10	23.48
DELETE	1.10	100.10	24.58
INSERT	1.10	100.10	24.58
DELETE	1.10	100.10	53.48
INSERT	1.10	100.10	53.48
DELETE	2.20	95.43	19.54
INSERT	2.20	95.43	19.54
DELETE	2.20	95.43	258.49
INSERT	2.20	95.43	258.49
DELETE	2.20	95.43	259.47
INSERT	2.20	95.43	259.47
DELETE	2.20	478.10	29.58
INSERT	2.20	478.10	29.58
DELETE	2.20	478.10	592.85
INSERT	2.20	478.10	592.85
DELETE	2.20	478.10	965.89
INSERT	2.20	478.10	965.89
DELETE	2.20	2473.10	298.85
INSERT	2.20	2473.10	298.85
DELETE	2.20	2473.10	589.90
INSERT	2.20	2473.10	589.90
DELETE	2.20	2473.10	986.68
INSERT	2.20	2473.10	986.68
DELETE	3.30	458.30	47.47
INSERT	3.30	458.30	47.47
DELETE	3.30	458.30	49.48
INSERT	3.30	458.30	49.48
DELETE	3.30	458.30	329.17
INSERT	3.30	458.30	329.17
DELETE	3.30	548.40	19.48
INSERT	3.30	548.40	19.48
DELETE	3.30	548.40	548.40
INSERT	3.30	548.40	548.40
DELETE	3.30	548.40	8584.10
INSERT	3.30	548.40	8584.10
DELETE	3.30	925.50	25.97
INSERT	3.30	925.50	25.97
DELETE	3.30	925.50	49.87
INSERT	3.30	925.50	49.87
DELETE	3.30	925.50	55.48
INSERT	3.30	925.50	55.48
call polarx.changeset_stats('c5');
SCHEMA	TABLE	NUM_INSERTS	NUM_UPDATES	NUM_DELETES	NUM_FILES	MEMORY_SIZE
test	c5	27	27	0	0	3942
call polarx.changeset_finish('c5');
SEQ	ROW
call polarx.changeset_stats('c5');
SCHEMA	TABLE	NUM_INSERTS	NUM_UPDATES	NUM_DELETES	NUM_FILES	MEMORY_SIZE
select * from c5;
id	tfloat	tdecimal	value
1.10	0.80	12.94	d
1.10	0.80	52.48	d
1.10	0.80	94.91	d
1.10	50.10	39.29	d
1.10	50.10	43.39	d
1.10	50.10	75.85	d
1.10	100.10	23.48	d
1.10	100.10	24.58	d
1.10	100.10	53.48	d
2.20	95.43	19.54	d
2.20	95.43	258.49	d
2.20	95.43	259.47	d
2.20	478.10	29.58	d
2.20	478.10	592.85	d
2.20	478.10	965.89	d
2.20	2473.10	298.85	d
2.20	2473.10	589.90	d
2.20	2473.10	986.68	d
3.30	458.30	47.47	d
3.30	458.30	49.48	d
3.30	458.30	329.17	d
3.30	548.40	19.48	d
3.30	548.40	548.40	d
3.30	548.40	8584.10	d
3.30	925.50	25.97	d
3.30	925.50	49.87	d
3.30	925.50	55.48	d
DROP TABLE IF EXISTS c5;
