DROP TABLE IF EXISTS c7;
CREATE TABLE c7 (
tdate date,
ttime time,
ttimestamp timestamp,
tdatetime datetime,
value VARCHAR(50) NOT NULL,
PRIMARY KEY (tdate, ttime, ttimestamp, tdatetime)
) ENGINE=InnoDB;
call polarx.changeset_start('c7');
TABLE
c7
call polarx.changeset_fetch('c7');
OP	PK
INSERT INTO c7 (tdate, ttime, ttimestamp, tdatetime, value)
VALUES
('2023-01-01', '08:00:00', '2023-01-01 08:00:00', '2023-01-01 08:00:00', 'DataEntry1'),
('2023-01-02', '13:37:45', '2023-01-02 13:37:45', '2023-01-02 13:37:45', 'DataEntry2'),
('2023-01-03', '22:15:00', '2023-01-03 22:15:00', '2023-01-03 22:15:00', 'DataEntry3'),
('2023-01-04', '01:42:11', '2023-01-04 01:42:11', '2023-01-04 01:42:11', 'DataEntry4'),
('2023-01-05', '09:58:33', '2023-01-05 09:58:33', '2023-01-05 09:58:33', 'DataEntry5'),
('2023-01-06', '17:25:47', '2023-01-06 17:25:47', '2023-01-06 17:25:47', 'DataEntry6'),
('2023-01-07', '03:13:00', '2023-01-07 03:13:00', '2023-01-07 03:13:00', 'DataEntry7'),
('2023-01-08', '10:48:55', '2023-01-08 10:48:55', '2023-01-08 10:48:55', 'DataEntry8'),
('2023-01-09', '19:26:11', '2023-01-09 19:26:11', '2023-01-09 19:26:11', 'DataEntry9'),
('2023-01-10', '05:00:00', '2023-01-10 05:00:00', '2023-01-10 05:00:00', 'DataEntry10'),
('2023-01-11', '13:33:22', '2023-01-11 13:33:22', '2023-01-11 13:33:22', 'DataEntry11'),
('2023-01-12', '22:10:45', '2023-01-12 22:10:45', '2023-01-12 22:10:45', 'DataEntry12'),
('2023-01-13', '01:57:11', '2023-01-13 01:57:11', '2023-01-13 01:57:11', 'DataEntry13'),
('2023-01-14', '10:34:32', '2023-01-14 10:34:32', '2023-01-14 10:34:32', 'DataEntry14'),
('2023-01-15', '19:11:55', '2023-01-15 19:11:55', '2023-01-15 19:11:55', 'DataEntry15'),
('2023-01-16', '03:29:11', '2023-01-16 03:29:11', '2023-01-16 03:29:11', 'DataEntry16'),
('2023-01-17', '12:06:33', '2023-01-17 12:06:33', '2023-01-17 12:06:33', 'DataEntry17'),
('2023-01-18', '20:43:55', '2023-01-18 20:43:55', '2023-01-18 20:43:55', 'DataEntry18'),
('2023-01-19', '05:11:19', '2023-01-19 05:11:19', '2023-01-19 05:11:19', 'DataEntry19'),
('2023-01-20', '13:48:47', '2023-01-20 13:48:47', '2023-01-20 13:48:47', 'DataEntry20'),
('2023-01-21', '22:26:11', '2023-01-21 22:26:11', '2023-01-21 22:26:11', 'DataEntry21'),
('2023-01-22', '01:03:23', '2023-01-22 01:03:23', '2023-01-22 01:03:23', 'DataEntry22'),
('2023-01-23', '09:50:55', '2023-01-23 09:50:55', '2023-01-23 09:50:55', 'DataEntry23'),
('2023-01-24', '18:28:17', '2023-01-24 18:28:17', '2023-01-24 18:28:17', 'DataEntry24'),
('2023-01-25', '02:55:39', '2023-01-25 02:55:39', '2023-01-25 02:55:39', 'DataEntry25'),
('2023-01-26', '11:32:51', '2023-01-26 11:32:51', '2023-01-26 11:32:51', 'DataEntry26'),
('2023-01-27', '20:09:43', '2023-01-27 20:09:43', '2023-01-27 20:09:43', 'DataEntry27');
select * from c7;
tdate	ttime	ttimestamp	tdatetime	value
2023-01-01	08:00:00	2023-01-01 08:00:00	2023-01-01 08:00:00	DataEntry1
2023-01-02	13:37:45	2023-01-02 13:37:45	2023-01-02 13:37:45	DataEntry2
2023-01-03	22:15:00	2023-01-03 22:15:00	2023-01-03 22:15:00	DataEntry3
2023-01-04	01:42:11	2023-01-04 01:42:11	2023-01-04 01:42:11	DataEntry4
2023-01-05	09:58:33	2023-01-05 09:58:33	2023-01-05 09:58:33	DataEntry5
2023-01-06	17:25:47	2023-01-06 17:25:47	2023-01-06 17:25:47	DataEntry6
2023-01-07	03:13:00	2023-01-07 03:13:00	2023-01-07 03:13:00	DataEntry7
2023-01-08	10:48:55	2023-01-08 10:48:55	2023-01-08 10:48:55	DataEntry8
2023-01-09	19:26:11	2023-01-09 19:26:11	2023-01-09 19:26:11	DataEntry9
2023-01-10	05:00:00	2023-01-10 05:00:00	2023-01-10 05:00:00	DataEntry10
2023-01-11	13:33:22	2023-01-11 13:33:22	2023-01-11 13:33:22	DataEntry11
2023-01-12	22:10:45	2023-01-12 22:10:45	2023-01-12 22:10:45	DataEntry12
2023-01-13	01:57:11	2023-01-13 01:57:11	2023-01-13 01:57:11	DataEntry13
2023-01-14	10:34:32	2023-01-14 10:34:32	2023-01-14 10:34:32	DataEntry14
2023-01-15	19:11:55	2023-01-15 19:11:55	2023-01-15 19:11:55	DataEntry15
2023-01-16	03:29:11	2023-01-16 03:29:11	2023-01-16 03:29:11	DataEntry16
2023-01-17	12:06:33	2023-01-17 12:06:33	2023-01-17 12:06:33	DataEntry17
2023-01-18	20:43:55	2023-01-18 20:43:55	2023-01-18 20:43:55	DataEntry18
2023-01-19	05:11:19	2023-01-19 05:11:19	2023-01-19 05:11:19	DataEntry19
2023-01-20	13:48:47	2023-01-20 13:48:47	2023-01-20 13:48:47	DataEntry20
2023-01-21	22:26:11	2023-01-21 22:26:11	2023-01-21 22:26:11	DataEntry21
2023-01-22	01:03:23	2023-01-22 01:03:23	2023-01-22 01:03:23	DataEntry22
2023-01-23	09:50:55	2023-01-23 09:50:55	2023-01-23 09:50:55	DataEntry23
2023-01-24	18:28:17	2023-01-24 18:28:17	2023-01-24 18:28:17	DataEntry24
2023-01-25	02:55:39	2023-01-25 02:55:39	2023-01-25 02:55:39	DataEntry25
2023-01-26	11:32:51	2023-01-26 11:32:51	2023-01-26 11:32:51	DataEntry26
2023-01-27	20:09:43	2023-01-27 20:09:43	2023-01-27 20:09:43	DataEntry27
call polarx.changeset_stats('c7');
SCHEMA	TABLE	NUM_INSERTS	NUM_UPDATES	NUM_DELETES	NUM_FILES	MEMORY_SIZE
test	c7	27	0	0	0	1917
call polarx.changeset_fetch('c7');
OP	tdate	ttime	ttimestamp	tdatetime
INSERT	2023-01-01	08:00:00	2023-01-01 08:00:00	2023-01-01 08:00:00
INSERT	2023-01-02	13:37:45	2023-01-02 13:37:45	2023-01-02 13:37:45
INSERT	2023-01-03	22:15:00	2023-01-03 22:15:00	2023-01-03 22:15:00
INSERT	2023-01-04	01:42:11	2023-01-04 01:42:11	2023-01-04 01:42:11
INSERT	2023-01-05	09:58:33	2023-01-05 09:58:33	2023-01-05 09:58:33
INSERT	2023-01-06	17:25:47	2023-01-06 17:25:47	2023-01-06 17:25:47
INSERT	2023-01-07	03:13:00	2023-01-07 03:13:00	2023-01-07 03:13:00
INSERT	2023-01-08	10:48:55	2023-01-08 10:48:55	2023-01-08 10:48:55
INSERT	2023-01-09	19:26:11	2023-01-09 19:26:11	2023-01-09 19:26:11
INSERT	2023-01-10	05:00:00	2023-01-10 05:00:00	2023-01-10 05:00:00
INSERT	2023-01-11	13:33:22	2023-01-11 13:33:22	2023-01-11 13:33:22
INSERT	2023-01-12	22:10:45	2023-01-12 22:10:45	2023-01-12 22:10:45
INSERT	2023-01-13	01:57:11	2023-01-13 01:57:11	2023-01-13 01:57:11
INSERT	2023-01-14	10:34:32	2023-01-14 10:34:32	2023-01-14 10:34:32
INSERT	2023-01-15	19:11:55	2023-01-15 19:11:55	2023-01-15 19:11:55
INSERT	2023-01-16	03:29:11	2023-01-16 03:29:11	2023-01-16 03:29:11
INSERT	2023-01-17	12:06:33	2023-01-17 12:06:33	2023-01-17 12:06:33
INSERT	2023-01-18	20:43:55	2023-01-18 20:43:55	2023-01-18 20:43:55
INSERT	2023-01-19	05:11:19	2023-01-19 05:11:19	2023-01-19 05:11:19
INSERT	2023-01-20	13:48:47	2023-01-20 13:48:47	2023-01-20 13:48:47
INSERT	2023-01-21	22:26:11	2023-01-21 22:26:11	2023-01-21 22:26:11
INSERT	2023-01-22	01:03:23	2023-01-22 01:03:23	2023-01-22 01:03:23
INSERT	2023-01-23	09:50:55	2023-01-23 09:50:55	2023-01-23 09:50:55
INSERT	2023-01-24	18:28:17	2023-01-24 18:28:17	2023-01-24 18:28:17
INSERT	2023-01-25	02:55:39	2023-01-25 02:55:39	2023-01-25 02:55:39
INSERT	2023-01-26	11:32:51	2023-01-26 11:32:51	2023-01-26 11:32:51
INSERT	2023-01-27	20:09:43	2023-01-27 20:09:43	2023-01-27 20:09:43
update c7 set value = "d";
call polarx.changeset_stats('c7');
SCHEMA	TABLE	NUM_INSERTS	NUM_UPDATES	NUM_DELETES	NUM_FILES	MEMORY_SIZE
test	c7	27	27	0	0	5751
call polarx.changeset_fetch('c7');
OP	tdate	ttime	ttimestamp	tdatetime
DELETE	2023-01-01	08:00:00	2023-01-01 08:00:00	2023-01-01 08:00:00
INSERT	2023-01-01	08:00:00	2023-01-01 08:00:00	2023-01-01 08:00:00
DELETE	2023-01-02	13:37:45	2023-01-02 13:37:45	2023-01-02 13:37:45
INSERT	2023-01-02	13:37:45	2023-01-02 13:37:45	2023-01-02 13:37:45
DELETE	2023-01-03	22:15:00	2023-01-03 22:15:00	2023-01-03 22:15:00
INSERT	2023-01-03	22:15:00	2023-01-03 22:15:00	2023-01-03 22:15:00
DELETE	2023-01-04	01:42:11	2023-01-04 01:42:11	2023-01-04 01:42:11
INSERT	2023-01-04	01:42:11	2023-01-04 01:42:11	2023-01-04 01:42:11
DELETE	2023-01-05	09:58:33	2023-01-05 09:58:33	2023-01-05 09:58:33
INSERT	2023-01-05	09:58:33	2023-01-05 09:58:33	2023-01-05 09:58:33
DELETE	2023-01-06	17:25:47	2023-01-06 17:25:47	2023-01-06 17:25:47
INSERT	2023-01-06	17:25:47	2023-01-06 17:25:47	2023-01-06 17:25:47
DELETE	2023-01-07	03:13:00	2023-01-07 03:13:00	2023-01-07 03:13:00
INSERT	2023-01-07	03:13:00	2023-01-07 03:13:00	2023-01-07 03:13:00
DELETE	2023-01-08	10:48:55	2023-01-08 10:48:55	2023-01-08 10:48:55
INSERT	2023-01-08	10:48:55	2023-01-08 10:48:55	2023-01-08 10:48:55
DELETE	2023-01-09	19:26:11	2023-01-09 19:26:11	2023-01-09 19:26:11
INSERT	2023-01-09	19:26:11	2023-01-09 19:26:11	2023-01-09 19:26:11
DELETE	2023-01-10	05:00:00	2023-01-10 05:00:00	2023-01-10 05:00:00
INSERT	2023-01-10	05:00:00	2023-01-10 05:00:00	2023-01-10 05:00:00
DELETE	2023-01-11	13:33:22	2023-01-11 13:33:22	2023-01-11 13:33:22
INSERT	2023-01-11	13:33:22	2023-01-11 13:33:22	2023-01-11 13:33:22
DELETE	2023-01-12	22:10:45	2023-01-12 22:10:45	2023-01-12 22:10:45
INSERT	2023-01-12	22:10:45	2023-01-12 22:10:45	2023-01-12 22:10:45
DELETE	2023-01-13	01:57:11	2023-01-13 01:57:11	2023-01-13 01:57:11
INSERT	2023-01-13	01:57:11	2023-01-13 01:57:11	2023-01-13 01:57:11
DELETE	2023-01-14	10:34:32	2023-01-14 10:34:32	2023-01-14 10:34:32
INSERT	2023-01-14	10:34:32	2023-01-14 10:34:32	2023-01-14 10:34:32
DELETE	2023-01-15	19:11:55	2023-01-15 19:11:55	2023-01-15 19:11:55
INSERT	2023-01-15	19:11:55	2023-01-15 19:11:55	2023-01-15 19:11:55
DELETE	2023-01-16	03:29:11	2023-01-16 03:29:11	2023-01-16 03:29:11
INSERT	2023-01-16	03:29:11	2023-01-16 03:29:11	2023-01-16 03:29:11
DELETE	2023-01-17	12:06:33	2023-01-17 12:06:33	2023-01-17 12:06:33
INSERT	2023-01-17	12:06:33	2023-01-17 12:06:33	2023-01-17 12:06:33
DELETE	2023-01-18	20:43:55	2023-01-18 20:43:55	2023-01-18 20:43:55
INSERT	2023-01-18	20:43:55	2023-01-18 20:43:55	2023-01-18 20:43:55
DELETE	2023-01-19	05:11:19	2023-01-19 05:11:19	2023-01-19 05:11:19
INSERT	2023-01-19	05:11:19	2023-01-19 05:11:19	2023-01-19 05:11:19
DELETE	2023-01-20	13:48:47	2023-01-20 13:48:47	2023-01-20 13:48:47
INSERT	2023-01-20	13:48:47	2023-01-20 13:48:47	2023-01-20 13:48:47
DELETE	2023-01-21	22:26:11	2023-01-21 22:26:11	2023-01-21 22:26:11
INSERT	2023-01-21	22:26:11	2023-01-21 22:26:11	2023-01-21 22:26:11
DELETE	2023-01-22	01:03:23	2023-01-22 01:03:23	2023-01-22 01:03:23
INSERT	2023-01-22	01:03:23	2023-01-22 01:03:23	2023-01-22 01:03:23
DELETE	2023-01-23	09:50:55	2023-01-23 09:50:55	2023-01-23 09:50:55
INSERT	2023-01-23	09:50:55	2023-01-23 09:50:55	2023-01-23 09:50:55
DELETE	2023-01-24	18:28:17	2023-01-24 18:28:17	2023-01-24 18:28:17
INSERT	2023-01-24	18:28:17	2023-01-24 18:28:17	2023-01-24 18:28:17
DELETE	2023-01-25	02:55:39	2023-01-25 02:55:39	2023-01-25 02:55:39
INSERT	2023-01-25	02:55:39	2023-01-25 02:55:39	2023-01-25 02:55:39
DELETE	2023-01-26	11:32:51	2023-01-26 11:32:51	2023-01-26 11:32:51
INSERT	2023-01-26	11:32:51	2023-01-26 11:32:51	2023-01-26 11:32:51
DELETE	2023-01-27	20:09:43	2023-01-27 20:09:43	2023-01-27 20:09:43
INSERT	2023-01-27	20:09:43	2023-01-27 20:09:43	2023-01-27 20:09:43
call polarx.changeset_stats('c7');
SCHEMA	TABLE	NUM_INSERTS	NUM_UPDATES	NUM_DELETES	NUM_FILES	MEMORY_SIZE
test	c7	27	27	0	0	3834
call polarx.changeset_finish('c7');
SEQ	ROW
call polarx.changeset_stats('c7');
SCHEMA	TABLE	NUM_INSERTS	NUM_UPDATES	NUM_DELETES	NUM_FILES	MEMORY_SIZE
select * from c7;
tdate	ttime	ttimestamp	tdatetime	value
2023-01-01	08:00:00	2023-01-01 08:00:00	2023-01-01 08:00:00	d
2023-01-02	13:37:45	2023-01-02 13:37:45	2023-01-02 13:37:45	d
2023-01-03	22:15:00	2023-01-03 22:15:00	2023-01-03 22:15:00	d
2023-01-04	01:42:11	2023-01-04 01:42:11	2023-01-04 01:42:11	d
2023-01-05	09:58:33	2023-01-05 09:58:33	2023-01-05 09:58:33	d
2023-01-06	17:25:47	2023-01-06 17:25:47	2023-01-06 17:25:47	d
2023-01-07	03:13:00	2023-01-07 03:13:00	2023-01-07 03:13:00	d
2023-01-08	10:48:55	2023-01-08 10:48:55	2023-01-08 10:48:55	d
2023-01-09	19:26:11	2023-01-09 19:26:11	2023-01-09 19:26:11	d
2023-01-10	05:00:00	2023-01-10 05:00:00	2023-01-10 05:00:00	d
2023-01-11	13:33:22	2023-01-11 13:33:22	2023-01-11 13:33:22	d
2023-01-12	22:10:45	2023-01-12 22:10:45	2023-01-12 22:10:45	d
2023-01-13	01:57:11	2023-01-13 01:57:11	2023-01-13 01:57:11	d
2023-01-14	10:34:32	2023-01-14 10:34:32	2023-01-14 10:34:32	d
2023-01-15	19:11:55	2023-01-15 19:11:55	2023-01-15 19:11:55	d
2023-01-16	03:29:11	2023-01-16 03:29:11	2023-01-16 03:29:11	d
2023-01-17	12:06:33	2023-01-17 12:06:33	2023-01-17 12:06:33	d
2023-01-18	20:43:55	2023-01-18 20:43:55	2023-01-18 20:43:55	d
2023-01-19	05:11:19	2023-01-19 05:11:19	2023-01-19 05:11:19	d
2023-01-20	13:48:47	2023-01-20 13:48:47	2023-01-20 13:48:47	d
2023-01-21	22:26:11	2023-01-21 22:26:11	2023-01-21 22:26:11	d
2023-01-22	01:03:23	2023-01-22 01:03:23	2023-01-22 01:03:23	d
2023-01-23	09:50:55	2023-01-23 09:50:55	2023-01-23 09:50:55	d
2023-01-24	18:28:17	2023-01-24 18:28:17	2023-01-24 18:28:17	d
2023-01-25	02:55:39	2023-01-25 02:55:39	2023-01-25 02:55:39	d
2023-01-26	11:32:51	2023-01-26 11:32:51	2023-01-26 11:32:51	d
2023-01-27	20:09:43	2023-01-27 20:09:43	2023-01-27 20:09:43	d
DROP TABLE IF EXISTS c7;
